date,text,id2020-05-25 18:12:22,"Liguei há pouco para o presidente do Uruguai, @LuisLacallePou, que está hoje em Rivera por conta dos novos casos de #coronavírus na região. Estamos em diálogo para comunhão de esforços entre nossas equipes de Saúde para manter uma ação cooperada na nossa fronteira.",@EduardoLeite_
2020-05-24 17:03:41,"RT @governo_rs: A gente não vai se entregar ao coronavírus de jeito nenhum, amigo e companheiro! Acessa https://t.co/6bljMLS6VK, coloca a m…",@EduardoLeite_
2020-05-19 20:07:24,"Além disso, farei um apelo no sentido de atender a ciência, dar segurança nas condições de enfrentamento ao #coronavírus p/ garantir segurança à população p/ q, assim, possamos criar um ambiente p/ a retomada econômica. https://t.co/6qOQ40PRE8",@EduardoLeite_
2020-05-16 14:32:36,"Graças a um esforço coordenado, entregamos hoje mais 10 leitos de UTI, com atendimento 100% SUS, no Hospital Geral (HG) de Caxias do Sul. Durante a pandemia, eles serão destinados exclusivamente para pacientes com #coronavírus. https://t.co/pAWAExjajJ",@EduardoLeite_
2020-05-14 18:35:25,RT @SSP_RS: A combinação do distanciamento social contra a Covid-19 e o trabalho integral das forças da @SSP_RS fez o RS atingir novas redu…,@EduardoLeite_
2020-05-13 19:04:15,"A pesquisa mostra que a população gaúcha segue a boa adesão ao distanciamento social: na 1ª e a 3ª etapa, o percentual da população q relatou sair de casa diariamente aumentou de 20,6% p/ 30,4%. Entre a 2ª e a 3ª rodada, subiu de 28,3% p/ 30,4%, percentual considerado estável.",@EduardoLeite_
2020-05-13 19:04:13,"Divulgamos hoje os resultados da terceira etapa da pesquisa de prevalência de #coronavírus na população gaúcha. Estima-se que 24.860 pessoas já tenham sido infectadas pelo vírus no Estado. Na fase anterior, eram 15 mil, e na primeira, 5,6 mil. https://t.co/MrL3oogtaC",@EduardoLeite_
2020-05-12 20:19:55,Temos a convicção de que estamos no caminho certo com o modelo do distanciamento controlado. Contamos com a colaboração de todos os gaúchos nesse processo! https://t.co/n3d3yxX4ur,@EduardoLeite_
2020-05-12 19:36:56,O @governo_rs está iniciando a distribuição de mais de 135 mil testes rápidos para detecção de anticorpos do #coronavírus a todos os municípios gaúchos e às CRSs. Outros cerca de 110 mil testes já haviam sido distribuídos. Os testes foram repassados ao Estado pelo @minsaude.,@EduardoLeite_
2020-05-09 15:54:13,"Debatemos nesta manhã medidas para proteger a saúde dos trabalhadores e evitar a disseminação do #coronavírus em frigoríficos, e para que não haja a interrupção das atividades nesses estabelecimentos e a consequente necessidade de abates sanitários. https://t.co/Hg8372W6oZ",@EduardoLeite_
2020-05-08 18:21:32,"A terceira fase da pesquisa de prevalência do #coronavírus no RS será feita entre este sábado e segunda-feira (11/5), em mais 4,5 mil moradores de Canoas, Caxias do Sul, Ijuí, Passo Fundo, Pelotas, Porto Alegre, Santa Cruz do Sul, Santa Maria e Uruguaiana.",@EduardoLeite_
2020-05-06 18:03:13,"O Mapa dos Leitos foi desenvolvido pela@SGGE_RS, em parceria com a @Procergs e com apoio da @SES_RS. São dados atualizados de 295 hospitais que permitem que a população consulte as taxas de internação do Estado, das macrorregiões e das 20 regiões do distanciamento controlado.",@EduardoLeite_
2020-05-06 18:03:12,"Disponibilizamos, a partir de hoje, um painel de monitoramento de leitos - https://t.co/iGtmqx91yt. A taxa de ocupação hospitalar nas redes pública e privada é um dos principais critérios utilizados no nosso modelo de distanciamento controlado.",@EduardoLeite_
2020-05-05 22:29:02,"Estamos com as aulas suspensas no Estado devido à pandemia de #coronavírus e buscamos uma forma de manter a condição de aprendizagem. Sabemos o efeito do distanciamento social no calendário escolar e no processo de formação e de acesso ao Ensino Superior, como é o caso do Enem.",@EduardoLeite_
2020-05-04 18:32:42,"O prazo para o envio de sugestões, por parte da sociedade civil, para a elaboração do modelo de distanciamento controlado foi prorrogado até hoje. As conclusões serão apresentadas na quinta-feira e o decreto deverá começar a valer a partir da próxima semana.",@EduardoLeite_
2020-04-30 20:23:04,"As aulas da rede privada seguem suspensas, mas as escolas poderão retomar as atividades se adotarem os protocolos de segurança que estarão estabelecidos no novo modelo de distanciamento controlado.",@EduardoLeite_
2020-04-30 20:22:17,"Como ocorreu uma evolução rápida da situação do #coronavírus nas regiões de Passo Fundo e Lajeado, fica determinada a vedação do comércio. Para a região Metropolitana, onde vigorava essa regra, a liberação do comércio passa a ser, agora, determinada pelo prefeito de cada cidade.",@EduardoLeite_
2020-04-30 20:22:17,"Até a publicação do decreto que define as regras para o modelo de distanciamento controlado, estará vigente um decreto transitório, a ser publicado, para definir o funcionamento do comércio.",@EduardoLeite_
2020-04-30 20:21:48,"Os protocolos ainda não estão finalizados. A sociedade civil pode enviar sugestões até domingo para que, com base no diálogo, encontremos uma solução que faça sentido para todos os setores. A versão final do distanciamento social controlado será divulgada na semana que vem.",@EduardoLeite_
2020-04-30 20:21:46,"O novo modelo de distanciamento prevê quatro estágios de controle, traduzidos em “bandeiras”: amarela, laranja, vermelha e preta. A amarela indica uma situação branda, com medidas mais amenas, e avançando o grau de restrições até a preta, qdo seria necessário o isolamento social.",@EduardoLeite_
2020-04-30 20:21:45,"Divulgamos, hoje, os critérios que embasam o formato de distanciamento controlado, que deve entrar em vigor ainda na primeira quinzena de maio. O novo modelo busca equilibrar a prioridade à vida com a retomada econômica do Estado.",@EduardoLeite_
2020-04-29 16:29:55,"A equipe do @minsaude disse estar fazendo o possível para atender as demandas dos Estados. Também ouvimos elogios do ministro à nossa pesquisa de prevalência, que será levada para outros lugares do país, bem como à nossa política de distanciamento.",@EduardoLeite_
2020-04-29 15:34:27,"A pesquisa é um dos parâmetros para traçarmos nossa estratégia de enfrentamento à doença no Estado. Com apoio da comunidade científica e acadêmica e da sociedade civil, podemos elaborar um plano de distanciamento social controlado que seja sustentável a longo prazo",@EduardoLeite_
2020-04-29 15:34:26,"Dos 4,5 mil testes aplicados, 6 testaram positivo na 2ª fase. Na 1ª, feita entre 11 e 13 de abril, 2 casos deram positivo para a #Covid19, o que representava 0,05%. A estimativa era de que existissem 5.650 contaminados pelo #coronavírus no Estado – um caso a cada 2 mil habitantes https://t.co/o7wLuyHekr",@EduardoLeite_
2020-04-29 15:34:25,"Apresentamos hoje o resultado da segunda etapa da pesquisa que mede a prevalência do #coronavírus no RS. O estudo indica que mais de 15 mil pessoas já teriam tido #Covid19 no Estado, o que equivale a um infectado a cada 769 habitantes - uma taxa de 0,13%. https://t.co/tTbmZa6qfG",@EduardoLeite_
2020-04-28 18:11:55,"O programa Inova RS lançou hoje um edital específico, de R$ 1,2 milhão, para apoio ao enfrentamento ao #coronavírus. A intenção é promover e fomentar soluções tecnológicas inovadas para serviços, produtos ou processos relacionados ao combate à Covid-19.",@EduardoLeite_
2020-04-28 18:10:48,"Para reduzir os impactos decorrentes do #coronavírus sobre as contas públicas, anunciamos um novo contingenciamento orçamentário de R$ 40 milhões. No início do ano, havíamos definido a redução anual de R$ 420 milhões de um total de R$ 3,1 bilhões do custeio contingenciável.",@EduardoLeite_
2020-04-27 19:16:48,"Vistoriamos hoje 30 novos leitos clínicos e 10 novos leitos de UTI no Hospital Regional de Santa Maria. Disponíveis para receber pacientes a partir de amanhã, os leitos serão destinados exclusivamente a pacientes com suspeita ou confirmação de #coronavírus. https://t.co/TLLn6CFhdr",@EduardoLeite_
2020-04-26 13:40:43,Participo agora de live da @xpinvestimentos sobre a atuação dos Estados contra o #coronavírus. Clique no link p/ acompanhar https://t.co/EwGz5muhYa,@EduardoLeite_
2020-04-24 18:34:51,"Neste final de semana, a @ufpel, com apoio de diversas universidades, fará uma nova rodada de testes rápidos no Rio Grande do Sul. Mais 4,5 mil pessoas serão testadas a afim de que possamos medir a prevalência do #coronavírus no Estado.",@EduardoLeite_
2020-04-23 17:54:16,"Prorrogaremos o prazo para que membros da sociedade civil possam enviar sugestões ao modelo de distanciamento social controlado que estamos elaborando. As contribuições podem ser enviadas até amanhã, às 18h, pelo email distanciamentocontrolado@seplag.rs.gov.br",@EduardoLeite_
2020-04-22 20:29:33,"Apresentei os dados referentes ao coronavírus no RS aos ministros gen Braga Netto, gen Augusto Heleno e gen Luiz Eduardo Ramos. Além do boletim diário, falei dos indicadores e do modelo de distanciamento social controlado, que deve ser implementado no Estado em maio. https://t.co/sn9FRHnsEW",@EduardoLeite_
2020-04-21 14:28:11,"A partir desses dados e sempre levando em consideração evidências científicas, o distanciamento social controlado se baseia em níveis de restrição, que serão aplicados conforme a região do Estado e o setor econômico.",@EduardoLeite_
2020-04-21 14:28:10,"O #coronavírus não está indo embora e não está passando. Está entre nós, circulará ao longo dos próximos períodos, e vamos conviver com isso. Por isso, precisamos continuar contando com o apoio da população p/ evitarmos um volume de contágio p/ além da nossa capacidade hospitalar",@EduardoLeite_
2020-04-21 14:28:09,"Apresentamos hoje um primeiro modelo do distanciamento social controlado, que deve ser adotado no RS em maio. Ressalto que o modelo não corresponde a uma flexibilização aleatória, a uma abertura desordenada ou a uma volta à normalidade.",@EduardoLeite_
2020-04-20 20:53:48,"Além disso, sem isolamento, estima-se q a demanda por leitos já estaria acima do disponível no começo de maio. C/ o distanciamento social, projeta-se essa alta demanda p/ o começo de junho. A análise de dados e de evidências científicas são fundamentais p/ embasar nossas decisões",@EduardoLeite_
2020-04-20 20:53:47,"O distanciamento social no RS terá evitado cerca de 300 mortes até o fim de abril, aponta estudo coordenado pela Sec. de Planejamento. A projeção mostra que, sem as medidas de distanciamento, o número de óbitos por Covid-19 seria 354. Com as regras, esse número cai para 62. https://t.co/DH8nFoSx6h",@EduardoLeite_
2020-04-20 20:46:13,"Encerramos hoje o processo que envolveu R$ 32 milhões de investimento do @governo_rs na aquisição de EPIs, incluindo máscaras, luvas, álcool 70%, óculos protetores e termômetros, entre outros. Também compramos mais 2.576 testes rápidos para diagnóstico de #coronavírus.",@EduardoLeite_
2020-04-18 14:36:33,"Estive em Canoas nesta manhã p/ conhecer o primeiro hospital de campanha voltado ao atendimento de pacientes de #coronavírus. A estrutura funcionará 24h, em frente à UPA Rio Branco, e tem 13 leitos clínicos e um de UTI, todos equipados com oxigênio. https://t.co/UYLEpOImV7",@EduardoLeite_
2020-04-16 20:11:40,"Respeito a legitimidade do Presidente de fazer as alterações em seu time, mas lamento a saída de um ministro que coordenou com competência e dedicação exemplar a política de enfrentamento ao covid-19. Agradeço a atenção que @lhmandetta deu ao RS e desejo êxito a Nelson Teich.",@EduardoLeite_
2020-04-16 18:34:58,"Também anunciamos a reabertura do Hospital Bom Jesus, em Taquara. Fechado desde 10 de março, o hospital será reaberto, com recursos da prefeitura (R$ 366 mil/mês) e do Estado (R$ 1,6 milhão/mês) e reforça o combate ao #coronavírus na região com mais 20 leitos clínicos e 10 de UTI",@EduardoLeite_
2020-04-15 21:09:34,"A pesquisa também mostra que, para cada diagnóstico do #coronavírus nessas 9 cidades, existem outros 4 casos não notificados. Em 1º de abril, o RS tinha 389 casos confirmados. Hoje, temos 747 casos e 19 óbitos.",@EduardoLeite_
2020-04-15 21:09:33,"Nossas decisões estão sendo tomadas com base em dados e análises do Comitê Científico, em pesquisa de prevalência do coronavírus e no controle de internações hospitalares.",@EduardoLeite_
2020-04-15 21:09:31,"Buscamos um equilíbrio entre saúde, emprego e amparo social aos que mais precisam. Estamos preparando o Estado para entrar em uma fase de distanciamento controlado, monitorando leitos hospitalares, a prevalência do #coronavírus e o domínio de informações.",@EduardoLeite_
2020-04-15 13:12:24,"Hoje, às 15h, anunciaremos os resultados da pesquisa do @governo_rs, em parceria com a @UFPel e outras universidades, referente à aplicação de testes para a detecção da Covid-19 no Estado. Tb anunciaremos o novo decreto c/ medidas para evitar a disseminação do #coronavírus no RS.",@EduardoLeite_
2020-04-14 18:02:08,"Amanhã, o @ipe_saude implantará o atendimento por teleconsultas. A iniciativa vai ao encontro das medidas de distanciamento social, que fizeram com que o número de consultas presenciais diminuíssem. O atendimento, de caráter temporário, será feito sem coparticipação dos usuários.",@EduardoLeite_
2020-04-14 17:59:30,"Também anunciamos a abertura, nos próximos dias, de 40 leitos clínicos no Hospital Regional de Santa Maria. A abertura já estava prevista, mas, agora, o funcionamento do hospital será direcionado ao atendimento do #coronavírus. Em breve tb serão abertos 10 leitos de UTI.",@EduardoLeite_
2020-04-14 17:58:57,"A segunda etapa da campanha de vacinação contra a gripe começa nesta quinta. A vacina não protege contra o #coronavírus, mas evita que a contaminação por gripe e a procura por hospitais. Na 1ª, 86% dos idosos gaúchos se vacinaram, assim como 84% dos profissionais de saúde.",@EduardoLeite_
2020-04-13 18:08:58,"Também anunciei que o Ministério da Saúde liberou R$ 260,8 milhões em recursos extras para o enfrentamento ao #coronavírus. Os municípios receberão R$ 181 milhões e, para o Estado, serão R$ 79,4 milhões.",@EduardoLeite_
2020-04-13 18:08:57,"O número de testes que será enviado vai variar de acordo com o a população total de cidade e do número de casos confirmados de #coronavírus. Para Porto Alegre, cidade com maior número de casos no RS, serão 183 caixas.",@EduardoLeite_
2020-04-10 14:04:01,"Toda a população gaúcha está sendo afetada pelo #coronavírus. Projetamos queda de arrecadação que trará consequências econômicas e, por isso, reduzirei, nos próximos 3 meses, minha remuneração em 30%. A sociedade paga um custo alto, e é um momento que demanda sacrifícios pessoais",@EduardoLeite_
2020-04-09 22:25:16,"Sancionei agora há pouco os quatro projetos de lei que alteram o quadro funcional do IPE Saúde e do IPE Prev. Agradeço, mais uma vez, a compreensão e o apoio dos nossos deputados, que entenderam a urgência da medida, inclusa no nosso rol de enfrentamento ao #coronavírus. https://t.co/FxjcSHrpUt",@EduardoLeite_
2020-04-09 18:20:42,"Já os produtores afetados pelo coronavírus terão as dívidas de custeio e investimento prorrogadas até 15 de agosto, abertura de linha de crédito emergencial de R$ 20 mil para produtores do Pronaf e de R$ 40 mil para produtores do Pronamp",@EduardoLeite_
2020-04-09 18:20:41,"O governo federal, por meio do @Mapa_Brasil, atendeu nosso apelo e anunciou medidas de socorro a agricultores gaúchos q/ tiveram perdas c/ a estiagem e em função do coronavírus. Ao lado do secretário @CovattiFilho, anunciei essas ações na nossa transmissão diária na internet",@EduardoLeite_
2020-04-09 14:06:42,"Na manhã de hoje, me reuni com os chefes de Poderes para apresentar um panorama da estratégia que vem sendo adotada pelo Estado no combate ao #coronavírus. https://t.co/1RZJ4zrAke",@EduardoLeite_
2020-04-09 12:26:14,"Em decreto publicado hoje, determinei que hospitais das redes pública e privada fiquem obrigados a registrar taxa de ocupação e o número de respiradores e de pacientes internados com suspeita ou confirmação de #coronavírus.",@EduardoLeite_
2020-04-08 20:03:58,"Projetos relacionados ao IPE Saúde e ao IPE Prev foram aprovados nesta tarde pela @AssembleiaRS. Agradeço mais uma vez aos deputados pela aprovação, de forma unânime, dessas iniciativas apresentadas dentro do rol de ações de enfrentamento ao #coronavírus https://t.co/wB91suwEv8",@EduardoLeite_
2020-04-08 19:34:25,"Assinamos termo de cooperação com a @ufrgsnoticias para viabilizarmos a realização de mais 500 testes de coronavírus. Na medida que mais insumos forem adquiridos, o laboratório da universidade poderá chegar a realizar 160 testes diários https://t.co/mX5egVSjlX",@EduardoLeite_
2020-04-08 18:54:52,Aproveitamos para esclarecer que a violência não tem crescido no Estado como consequência do isolamento social. Nossos registros oficiais mostram justamente o contrário. O relatório completo dos índices de criminalidade está no site https://t.co/rLC9IuxkNZ,@EduardoLeite_
2020-04-07 21:20:55,"Recebemos, durante reunião diária do Gabinete de Crise, o prefeito @marchezan_ e a equipe da Saúde de POA para alinhar, entre Estado e Capital, medidas de enfrentamento ao #coronavírus. Importante reunião c/ troca de informação e discussão de cenários em torno do vírus https://t.co/Wd002P8res",@EduardoLeite_
2020-04-07 19:39:20,"Assinamos nesta tarde o termo de compromisso com o @mp_rs p/ destinação de R$ 4,95 milhões do Fundo para Reconstituição de Bens Lesados (FRBL) p/ ações de enfrentamento ao #coronavírus no RS. Os recursos irão reforçar a estrutura da rede pública hospitalar em quatro regiões. https://t.co/4sDxL16WrG",@EduardoLeite_
2020-04-07 19:08:54,"Estamos aprimorando nosso sistema de monitoramento e de apuração de dados. Por isso, precisamos da cooperação dos hospitais para que façam o controle do número de internações em UTI de casos graves de #coronavírus e atualizem diariamente o sistema.",@EduardoLeite_
2020-04-07 19:08:53,"Contratamos hoje 17 novos profissionais de saúde para reforçar a equipe do Laboratório Central do Estado (Lacen), responsável pela aplicação de testes de #coronavírus. São dois médicos, sete enfermeiros, quatro farmacêuticos e quatro biólogos.",@EduardoLeite_
2020-04-03 20:35:59,"Assinei, hoje, o convênio que oficializa a parceria entre o Estado e a @Ufpel para realizar, com outras quatro universidades federais (Ufpel, Ufsm, Ufrgs, Unipampa e UFCSPA), um estudo de amostragem para analisar a evolução do #coronavírus no Estado. https://t.co/VF3ft8g8nG",@EduardoLeite_
2020-04-03 14:43:20,É uma importante oportunidade para embasar cientificamente as nossas ações de fortalecimento da rede de assistência hospitalar e em questões como testagem e política de distanciamento social. Agradeço a todos integrantes do comitê pela contribuição.,@EduardoLeite_
2020-04-03 14:43:19,"Além das reuniões diárias do Gabinete de Crise que atua na coordenação das ações de enfrentamento ao #coronavírus, mantenho contato permanente com os comitês formados por especialistas de vários setores da sociedade para avaliar os cenários e tomar decisões. https://t.co/CNdzRX4n47",@EduardoLeite_
2020-04-02 18:51:30,Conversei hoje com os demais governadores dos Estados que integram o Cosud (Sul e Sudeste) para elencarmos demandas ao governo federal para o enfrentamento ao #coronavírus. Queremos evitar o colapso nas contas públicas estaduais e municipais.,@EduardoLeite_
2020-04-01 12:41:39,"Responderei a perguntas da imprensa daqui a pouco, principalmente sobre o novo decreto, que restringe o funcionamento do comércio para evitar a propagação do #coronavírus no RS. https://t.co/dUUv6badjS",@EduardoLeite_
2020-04-01 01:08:26,"Com base em evidências científicas e na evolução do contágio por coronavírus, determinei agora à noite o fechamento do comércio em todo o território estadual até o dia 15 de abril. A decisão será publicada amanhã em edição extra do Diário Oficial do Estado.",@EduardoLeite_
2020-03-31 18:29:40,"Não vemos, neste momento, a possibilidade de, durante o mês de abril, regredirmos em relação às regras de restrição de contato. Embora em muitos casos não desenvolvam a doença com maior gravidade, jovens e crianças podem transmitir o #coronavírus.",@EduardoLeite_
2020-03-31 14:57:22,"Para reforçar o combate ao coronavírus na região, o governo garantiu a instalação de 20 leitos de UTI em Taquara, com investimento de mais de R$ 1,5 milhão mensais.",@EduardoLeite_
2020-03-31 14:57:21,"O hospital inaugurou nesta semana o atendimento em tenda externa para pacientes com sinais e sintomas de coronavírus. O serviço, que funciona das 7h às 19h, está localizado ao lado do setor de Emergência. https://t.co/fPuwHZEPCm",@EduardoLeite_
2020-03-31 14:57:20,"No total, 66 novos leitos de enfermaria estão em construção no local e o governo espera entregar 20 novos leitos de UTI. A expectativa é de que a abertura dos novos espaços, que atenderão pacientes com coronavírus, ocorra até o fim de abril. https://t.co/jUi02TSIRZ",@EduardoLeite_
2020-03-31 14:57:20,"Estive hoje no Hospital Vila Nova, em Porto Alegre, ao lado do prefeito @marchezan_. A instituição é uma das referências no cuidado a pacientes suspeitos de coronavírus e ampliou a sua capacidade para atender a essa demanda, com apoio do governo do Estado. https://t.co/i9Hh59ZtmT",@EduardoLeite_
2020-03-30 18:33:28,Anunciamos hoje mais duas medidas para mitigar o impacto econômico causado pelas restrições impostas para evitar a propagação do #coronavírus no RS. Uma delas via Banco de Desenvolvimento do Extremo Sul (BRDE).,@EduardoLeite_
2020-03-26 19:50:01,"São 95 leitos de cuidados prolongados, destinados a pacientes com gravidade intermediária. Assim, a ocupação de leitos de UTI fica concentrada naqueles pacientes com #coronavírus que evoluam com maior gravidade. https://t.co/eFmEM5eA6G",@EduardoLeite_
2020-03-26 18:55:15,"Essa medida irá auxiliar a população na busca dos produtos, especialmente itens mais importantes de prevenção contra o #coronavírus. Tb será liberado o telefone do estabelecimento p/ que o usuário possa confirmar a disponibilidade da mercadoria antes de se deslocar ao local.",@EduardoLeite_
2020-03-26 18:55:14,"Anunciamos hoje medidas administrativas p/ facilitar os processos de trabalho das empresas e, também, de comunicação com a sociedade devido ao #coronavírus. O objetivo é simplificar obrigações dos contribuintes p/ minimizar os impactos gerados pelo vírus.",@EduardoLeite_
2020-03-25 19:38:24,"Entre as medidas p/ frear o avanço do #coronavírus, o @governo_rs lançou seis novos serviços digitais na plataforma unificada https://t.co/zaLi8cXErq. Objetivo é ampliar a oferta de soluções via internet, contribuindo p/ reduzir a necessidade de deslocamento até órgãos públicos.",@EduardoLeite_
2020-03-25 16:50:35,"Em instantes, estarei ao vivo no Facebook do Governo do Estado para darmos início a uma série de transmissões diárias sobre o coronavírus. 

Acompanhe em https://t.co/W6pPe6I2nZ",@EduardoLeite_
2020-03-24 18:40:45,"A reunião que trata do assunto, e que vai resultar em outras medidas, está sendo acompanhada pelo secretário de Meio Ambiente, @arturlemosjr. Nosso objetivo é minimizar os efeitos da epidemia do coronavírus na vida dos gaúchos. Em breve, teremos mais novidades sobre esse tema.",@EduardoLeite_
2020-03-24 16:47:58,Tivemos uma reunião positiva hoje com o presidente @jairbolsonaro e ministros para estabelecer coordenação de esforços no enfrentamento do coronavírus e apresentar algumas demandas sanitárias e econômicas importantes para o RS. https://t.co/7zOkzjuapg,@EduardoLeite_
2020-03-23 16:59:17,"Conversei hoje com governadores dos Estados do Sul e do Sudeste. Oportunidade para alinhar ações no enfrentamento ao #coronavírus. Na reunião, também interagimos com o ministro @tarcisiogdf sobre medidas que garantam o abastecimento e os serviços essenciais à população. https://t.co/Khk3VZGZH3",@EduardoLeite_
2020-03-23 13:45:34,"Reforço no enfrentamento ao #coronavírus 

👉🏻 https://t.co/2mpPtxdbOt https://t.co/ay5GyoFajg",@EduardoLeite_
2020-03-20 22:34:21,O novo decreto também reforça as nossas ações de enfrentamento ao coronavírus no que diz respeito à atividade econômica. Estamos garantindo que não haja desabastecimento e que os serviços essenciais continuem funcionando.,@EduardoLeite_
2020-03-20 22:34:20,"Não é veraneio e nem férias. É isolamento. Por isso, determinamos o fechamento de todas as praias, inclusive as de água doce. Além disso, a restrição de circulação de pessoas com fechamento dos acessos municipais é algo inadequado e que extrapola a competência dos prefeitos.",@EduardoLeite_
2020-03-20 22:34:20,"Assinei há pouco um novo decreto, que estabelece mais medidas com o objetivo de minimizar os efeitos sanitários e econômicos da pandemia de coronavírus. O documento determina a interdição das praias do Litoral gaúcho e a proibição do fechamento dos limites entre municípios.",@EduardoLeite_
